{
  "schema_version": "0.1.0",
  "record_type": "raw",
  "product_id": "p_7df6497269eb4b70",
  "source_url": "https://thinkingmu.com/en/products/white-hemp-jules-shirt",
  "final_url": "https://thinkingmu.com/en/products/white-hemp-jules-shirt",
  "canonical_url": "https://thinkingmu.com/en/products/white-hemp-jules-shirt",
  "merchant_name": "Thinking MU",
  "merchant_domain": "thinkingmu.com",
  "brand": "Thinking MU",
  "scraped_at": "2026-09-29T22:36:35Z",
  "page_language": "en",
  "raw_product_name": "White hemp Jules shirt",
  "raw_title": "Sustainable Shirt White Hemp Jules Man | Thinking Mu",
  "raw_h1": "White hemp Jules shirt",
  "raw_meta_title": "Sustainable Shirt White Hemp Jules Man | Thinking Mu",
  "raw_meta_description": "Discover the Shirt White Hemp Jules by Thinking MU, made with hemp and certified by GOTS, OCS y GRS. Man sustainable fashion with Mediterranean inspiration.",
  "raw_full_description": "Jules white hemp shirt\n→ V-neckline with shirt collar\n→ Short sleeves\n→ Regular fit\n→ Front closure with buttons\n→ Fabric: hemp mixed with tencel, weight 135 gsm (Lightweight fabric)\n→ Length of garment: Regular\nRef: MSH00210\nMeasurements in size M: 72 cm total length, 49 cm back width and 24 cm sleeve length.\nHemp is an exceptional plant that provides one of the lightest and most breathable sustainable fibers. Main features:\nLESS WATER: It needs 95% less water than cotton and produces 2.5 times more fiber.\nLESS C02: Its cultivation in the field helps the CO2 absorption process.\nLESS PESTICIDES: It does not require the use of chemical pesticides or fertilizers for its cultivation.\nLESS TIME: It is a renewable fiber that grows quickly and vigorously in a wide variety of climates.\nLESS WASTE: The plant produces 250% more fiber than cotton and 600% more than flax using the same area of land.\nLESS CROP: The area required for cultivation is almost half that of cotton.\nLESS SOIL EROSION: Prevents soil erosion caused by logging.\nThe model is 176cm tall and wears a size M.",
  "raw_short_description": null,
  "raw_description": {
    "sections": [
      {
        "heading": "PRODUCT DESCRIPTION",
        "section_type": "overview",
        "text": "Jules white hemp shirt\n→ V-neckline with shirt collar\n→ Short sleeves\n→ Regular fit\n→ Front closure with buttons\n→ Fabric: hemp mixed with tencel, weight 135 gsm (Lightweight fabric)\n→ Length of garment: Regular\nRef: MSH00210\nMeasurements in size M: 72 cm total length, 49 cm back width and 24 cm sleeve length.\nHemp is an exceptional plant that provides one of the lightest and most breathable sustainable fibers. Main features:\nLESS WATER: It needs 95% less water than cotton and produces 2.5 times more fiber.\nLESS C02: Its cultivation in the field helps the CO2 absorption process.\nLESS PESTICIDES: It does not require the use of chemical pesticides or fertilizers for its cultivation.\nLESS TIME: It is a renewable fiber that grows quickly and vigorously in a wide variety of climates.\nLESS WASTE: The plant produces 250% more fiber than cotton and 600% more than flax using the same area of land.\nLESS CROP: The area required for cultivation is almost half that of cotton.\nLESS SOIL EROSION: Prevents soil erosion caused by logging.\nThe model is 176cm tall and wears a size M."
      },
      {
        "heading": "COMPOSITION, ORIGIN AND CARE",
        "section_type": "details",
        "text": "Composition: 55% Hemp + 45% Tencel\nDesigned in Barcelona\nOrigin\nFabric: China\nDyeing and Printing: China\nManufacturing: China\nCare:\nMACHINE WASH AT 30º WITH REDUCED MECHANICAL ACTION\nDO NOT BLEACH\nDO NOT TUMBLE DRY\nIRON AT LOW TEMPERATURE\nDOES NOT ALLOW DRY CLEANING"
      },
      {
        "heading": "SHIPPING & DELIVERY",
        "section_type": "shipping",
        "text": "Shipping\nStore pickup\n1-3 business days\nFree\nDrop point delivery\n(Currently unavailable)\n1-3 business days\n3,90€\nFree shipping from 100€\nHome delivery\n1-3 business days\n4,90 €\nFree shipping from 100€\nCHECK SPECIAL SHIPPING CONDITIONS\n+INFO\nReturns\nYou have 30 days to make your return using any of the following methods\nIn-store return\nFree\nDrop-off point return\n3,90€\nHome pick-up return\n3,90€\nCHECK RETURN METHODS AND CONDITIONS\n+INFO"
      },
      {
        "heading": "IMPACT",
        "section_type": "sustainability",
        "text": "This garment is made with TENCEL fibers™, obtained from sustainable and certified wood and cellulose. All the processes this garment has gone through are environmentally and socially responsible. All our garments are well thought out, planned and produced, from the smallest detail to the minimum impact.\nTENCELTM"
      }
    ],
    "combined_text": "PRODUCT DESCRIPTION\nJules white hemp shirt\n→ V-neckline with shirt collar\n→ Short sleeves\n→ Regular fit\n→ Front closure with buttons\n→ Fabric: hemp mixed with tencel, weight 135 gsm (Lightweight fabric)\n→ Length of garment: Regular\nRef: MSH00210\nMeasurements in size M: 72 cm total length, 49 cm back width and 24 cm sleeve length.\nHemp is an exceptional plant that provides one of the lightest and most breathable sustainable fibers. Main features:\nLESS WATER: It needs 95% less water than cotton and produces 2.5 times more fiber.\nLESS C02: Its cultivation in the field helps the CO2 absorption process.\nLESS PESTICIDES: It does not require the use of chemical pesticides or fertilizers for its cultivation.\nLESS TIME: It is a renewable fiber that grows quickly and vigorously in a wide variety of climates.\nLESS WASTE: The plant produces 250% more fiber than cotton and 600% more than flax using the same area of land.\nLESS CROP: The area required for cultivation is almost half that of cotton.\nLESS SOIL EROSION: Prevents soil erosion caused by logging.\nThe model is 176cm tall and wears a size M.\n\nCOMPOSITION, ORIGIN AND CARE\nComposition: 55% Hemp + 45% Tencel\nDesigned in Barcelona\nOrigin\nFabric: China\nDyeing and Printing: China\nManufacturing: China\nCare:\nMACHINE WASH AT 30º WITH REDUCED MECHANICAL ACTION\nDO NOT BLEACH\nDO NOT TUMBLE DRY\nIRON AT LOW TEMPERATURE\nDOES NOT ALLOW DRY CLEANING\n\nSHIPPING & DELIVERY\nShipping\nStore pickup\n1-3 business days\nFree\nDrop point delivery\n(Currently unavailable)\n1-3 business days\n3,90€\nFree shipping from 100€\nHome delivery\n1-3 business days\n4,90 €\nFree shipping from 100€\nCHECK SPECIAL SHIPPING CONDITIONS\n+INFO\nReturns\nYou have 30 days to make your return using any of the following methods\nIn-store return\nFree\nDrop-off point return\n3,90€\nHome pick-up return\n3,90€\nCHECK RETURN METHODS AND CONDITIONS\n+INFO\n\nIMPACT\nThis garment is made with TENCEL fibers™, obtained from sustainable and certified wood and cellulose. All the processes this garment has gone through are environmentally and socially responsible. All our garments are well thought out, planned and produced, from the smallest detail to the minimum impact.\nTENCELTM"
  },
  "raw_bullet_points": [
    "→ V-neckline with shirt collar",
    "→ Short sleeves",
    "→ Regular fit",
    "→ Front closure with buttons",
    "→ Fabric: hemp mixed with tencel, weight 135 gsm (Lightweight fabric)",
    "→ Length of garment: Regular"
  ],
  "raw_specifications": null,
  "raw_material_text": "→ Fabric: hemp mixed with tencel, weight 135 gsm (Lightweight fabric)\nComposition: 55% Hemp + 45% Tencel",
  "raw_fit_text": "→ Regular fit",
  "raw_size_text": "XS\nS\nM\nL\nXL\nXXL",
  "raw_color_text": "Snow White",
  "raw_care_text": "Care:\nMACHINE WASH AT 30º WITH REDUCED MECHANICAL ACTION\nDO NOT BLEACH\nDO NOT TUMBLE DRY\nIRON AT LOW TEMPERATURE\nDOES NOT ALLOW DRY CLEANING",
  "raw_features_text": "Hemp is an exceptional plant that provides one of the lightest and most breathable sustainable fibers. Main features:\nLESS WATER: It needs 95% less water than cotton and produces 2.5 times more fiber.\nLESS C02: Its cultivation in the field helps the CO2 absorption process.\nLESS PESTICIDES: It does not require the use of chemical pesticides or fertilizers for its cultivation.\nLESS TIME: It is a renewable fiber that grows quickly and vigorously in a wide variety of climates.\nLESS WASTE: The plant produces 250% more fiber than cotton and 600% more than flax using the same area of land.\nLESS CROP: The area required for cultivation is almost half that of cotton.\nLESS SOIL EROSION: Prevents soil erosion caused by logging.",
  "raw_shipping_text": "Shipping\nStore pickup\n1-3 business days\nFree\nDrop point delivery\n(Currently unavailable)\n1-3 business days\n3,90€\nFree shipping from 100€\nHome delivery\n1-3 business days\n4,90 €\nFree shipping from 100€\nCHECK SPECIAL SHIPPING CONDITIONS\n+INFO",
  "raw_return_text": "Returns\nYou have 30 days to make your return using any of the following methods\nIn-store return\nFree\nDrop-off point return\n3,90€\nHome pick-up return\n3,90€\nCHECK RETURN METHODS AND CONDITIONS\n+INFO",
  "raw_price_text": "99,90 €",
  "raw_sale_price_text": null,
  "raw_availability_text": "Sold out",
  "raw_rating_text": null,
  "raw_review_count_text": null,
  "raw_category_text": "Shirts",
  "raw_breadcrumbs": [
    "Thinking MU",
    "White hemp Jules shirt"
  ],
  "raw_variants": [
    {
      "merchant_variant_id": "53853668835654",
      "raw_name": "White hemp Jules shirt - XS",
      "raw_options": {
        "Size": "XS"
      },
      "raw_price_text": "99.90",
      "raw_availability_text": "http://schema.org/OutOfStock",
      "sku": "8435512906724",
      "gtin": "8435512906724",
      "mpn": null,
      "url": "https://thinkingmu.com/en/products/white-hemp-jules-shirt?variant=53853668835654",
      "image_url": "https://thinkingmu.com/cdn/shop/files/MSH00210_0.jpg?v=1741708633&width=1920"
    },
    {
      "merchant_variant_id": "53853668868422",
      "raw_name": "White hemp Jules shirt - S",
      "raw_options": {
        "Size": "S"
      },
      "raw_price_text": "99.90",